Food id	Food	Verified Subsititions	Food substitutions	Similar Food
usda#11098	Brussels sprouts, raw	['Broccoli, raw', 'Kohlrabi, raw', 'Cauliflower, green, raw', 'Cabbage, red, raw', 'Tomatoes, green, raw', 'Rutabagas, raw', 'Cabbage, chinese, raw', 'Cress, garden, raw', 'Cabbage, raw', 'Mustard greens, raw', 'Yambean, raw', 'Squash, summer, zucchini', 'Tomatoes, red, ripe', 'Turnips, raw', 'Squash, summer, all varieties', 'Arugula, raw']	['Arugula, raw']	['Broccoli, raw', 'Lemon juice from concentrate, canned or bottled', 'Grapefruit, raw, pink and red and white', 'Papayas, raw', 'Lemon juice, raw', 'Lemons, raw, without peel', 'Kohlrabi, raw', 'Cauliflower, green, raw', 'Tomato juice, canned, with salt added', 'Tomato juice, canned, without salt added', 'Vegetable juice cocktail, canned', 'Currants, red and white, raw', 'Cabbage, red, raw', 'Tomatoes, green, raw', 'Rutabagas, raw', 'Cabbage, chinese, raw', 'Cress, garden, raw', 'Melons, honeydew, raw', 'Cabbage, raw', 'Mustard greens, raw', 'Yambean, raw', 'Squash, summer, zucchini', 'Tomatoes, red, ripe', 'Turnips, raw', 'Squash, summer, all varieties', 'Limes, raw']
usda#11940	Pickles, cucumber, sweet	['Capers, canned']	['Cranberry-orange relish, canned', 'Capers, canned']	['Peach nectar, canned, with sucralose', 'Apples, canned, sweetened', 'Cranberries, dried, sweetened ', 'Papaya nectar, canned', 'Pomegranate juice, bottled', 'Pears, canned, juice pack', 'Blueberries, dried, sweetened', 'Peaches, canned, light syrup pack', 'Cherries, tart, dried', 'Pears, canned, light syrup pack', 'Ice cream sandwich, vanilla, light', 'Pear nectar, canned, without added ascorbic acid', 'Pears, canned, heavy syrup', 'Peaches, canned, heavy syrup', 'Peaches, canned, juice pack', 'Pears, canned, heavy syrup pack', 'Plums, canned, heavy syrup', 'Applesauce, canned, unsweetened', 'Peaches, canned, heavy syrup pack', 'Apple juice, canned or bottled, unsweetened', 'Applesauce, canned, sweetened', 'Plums, canned, purple', 'Fruit cocktail, canned', 'Pears, raw']
usda#11527	Tomatoes, green, raw	['Cabbage, red, raw', 'Cauliflower, green, raw', 'Cress, garden, raw', 'Rutabagas, raw', 'Cabbage, chinese, raw', 'Mustard greens, raw', 'Cabbage, raw', 'Brussels sprouts, raw', 'Broccoli, raw', 'Tomato juice, canned, with salt added', 'Kohlrabi, raw', 'Yambean, raw',  'Tomato juice, canned, without salt added', 'Turnips, raw', 'Squash, summer, all varieties', 'Tomatoes, red, ripe', 'Squash, summer, zucchini']	['Sauce, salsa, ready-to-serve']	['Cabbage, red, raw', 'Currants, red and white, raw', 'Cauliflower, green, raw', 'Cress, garden, raw', 'Rutabagas, raw', 'Melons, honeydew, raw', 'Cabbage, chinese, raw', 'Mustard greens, raw', 'Cabbage, raw', 'Lemon juice from concentrate, canned or bottled', 'Brussels sprouts, raw', 'Grapefruit, raw, pink and red and white', 'Broccoli, raw', 'Lemon juice, raw', 'Tomato juice, canned, with salt added', 'Lemons, raw, without peel', 'Papayas, raw', 'Kohlrabi, raw', 'Yambean, raw', 'Vegetable juice cocktail, canned', 'Tomato juice, canned, without salt added', 'Turnips, raw', 'Squash, summer, all varieties', 'Tomatoes, red, ripe', 'Squash, summer, zucchini', 'Limes, raw']
usda#05000	Chicken, broiler, rotisserie	['Fish, salmon, pink', 'Fish, halibut, Atlantic and Pacific']	['Fat, chicken']	['Fish, salmon, pink', 'Fish, halibut, Atlantic and Pacific']
usda#09298	Raisins, dark, seedless	['Currants, zante, dried', 'Figs, dried, stewed', 'Peaches, dried, sulfured', 'Plums, dried, uncooked', 'Pears, dried, sulfured', 'Bananas, dehydrated, or banana powder', 'Plums, dried, stewed']	['Peaches, spiced, canned']	['Currants, zante, dried', 'Figs, dried, stewed', 'Peaches, dried, sulfured', 'Plums, dried, uncooked', 'Pears, dried, sulfured', 'Bananas, dehydrated, or banana powder', 'Plums, dried, stewed']
usda#09130	Grape juice, canned or bottled, unsweetened	['Orange Pineapple Juice Blend', 'Juice, apple and grape blend, with added ascorbic acid', 'Lime juice, raw', 'Pineapple, canned, juice pack', 'Grapefruit juice, white, raw', 'Tangerine juice, raw', 'Orange juice, chilled, includes from concentrate', 'Grapefruit juice, white, canned or bottled']	['Vinegar, red wine']	['Strawberries, frozen, unsweetened ', 'Orange Pineapple Juice Blend', 'Strawberries, raw', 'Blueberries, frozen, sweetened', 'Pineapple, canned, light syrup pack', 'Juice, apple and grape blend, with added ascorbic acid', 'Oranges, raw, all commercial varieties', 'Pineapple, raw, all varieties', 'Pineapple, canned, water pack', 'Lime juice, raw', 'Pineapple, canned, juice pack', 'Pineapple, canned, heavy syrup pack', 'Strawberries, frozen, sweetened', 'Grapefruit juice, white, raw', 'Tangerines, canned', 'Tangerine juice, raw', 'Blueberries, raw', 'Orange juice, chilled, includes from concentrate', 'Grapefruit juice, white, canned or bottled']