Food id	Food	Verified Subsititions	Food substitutions	Similar Food
usda#09229	Papaya nectar, canned	['Peach nectar, canned, with sucralose', 'Apples, canned, sweetened', 'Peaches, canned, light syrup pack', 'Cranberries, dried, sweetened ', 'Pears, canned, light syrup pack', 'Pomegranate juice, bottled', 'Blueberries, dried, sweetened', 'Pear nectar, canned, without added ascorbic acid', 'Pears, canned, heavy syrup', 'Pears, canned, juice pack', 'Plums, canned, heavy syrup', 'Peaches, canned, heavy syrup', 'Peaches, canned, heavy syrup pack', 'Pears, canned, heavy syrup pack', 'Peaches, canned, juice pack', 'Applesauce, canned, sweetened', 'Apple juice, canned or bottled, unsweetened', 'Fruit cocktail, canned, heavy syrup', 'Nance, canned, syrup']	['Oil, almond', 'SILK Peach soy yogurt', 'Ham, honey, smoked', 'Mango, dried, sweetened', 'Apple juice, frozen concentrate, unsweetened', 'Nance, canned, syrup']	['Pickles, cucumber, sweet ', 'Peach nectar, canned, with sucralose', 'Apples, canned, sweetened', 'Peaches, canned, light syrup pack', 'Cranberries, dried, sweetened ', 'Pears, canned, light syrup pack', 'Pomegranate juice, bottled', 'Blueberries, dried, sweetened', 'Pear nectar, canned, without added ascorbic acid', 'Pears, canned, heavy syrup', 'Pears, canned, juice pack', 'Cherries, tart, dried', 'Plums, canned, heavy syrup', 'Peaches, canned, heavy syrup', 'Ice cream sandwich, vanilla, light', 'Peaches, canned, heavy syrup pack', 'Pears, canned, heavy syrup pack', 'Peaches, canned, juice pack', 'Applesauce, canned, sweetened', 'Apple juice, canned or bottled, unsweetened', 'Milk dessert bar, frozen, made from lowfat milk', 'Fruit cocktail, canned']
usda#09206	Orange juice, raw	['Mangos, raw', 'Orange juice, chilled, includes from concentrate', 'Tangerine juice, raw', 'Tangerines, canned', 'Oranges, raw, all commercial varieties', 'Acerola juice, raw', 'Orange juice, frozen concentrate, unsweetened', 'Apple juice, frozen concentrate, unsweetened', 'Tangerines, raw', 'Lemon peel, raw', 'Pineapple, canned, juice pack', 'Orange juice, raw ', 'Lemon juice, raw', 'Lime juice, raw', 'Abiyuch, raw']	['Acerola juice, raw', 'Milk, filled, fluid', 'Orange juice, frozen concentrate, unsweetened', 'Vinegar, cider', 'Apple juice, frozen concentrate, unsweetened', 'Tangerines, raw', 'Milk, buttermilk, fluid', 'Chicken, canned, no broth', 'Sapote, mamey, raw', 'Lemon peel, raw', 'Pineapple, canned, juice pack', 'Orange juice, raw ', 'Lemon juice, raw', 'Vanilla extract', 'Water convolvulus,raw', 'Lime juice, raw', 'Abiyuch, raw']	['Onions, spring or scallions, raw', 'Cauliflower, raw', 'Mangos, raw', 'Corn, sweet, yellow', 'Orange juice, chilled, includes from concentrate', 'Tangerine juice, raw', 'Tangerines, canned', 'Oranges, raw, all commercial varieties']
usda#09008	Apples, canned, sweetened	['Peach nectar, canned, with sucralose', 'Pomegranate juice, bottled', 'Papaya nectar, canned', 'Cranberries, dried, sweetened ', 'Blueberries, dried, sweetened', 'Pears, canned, juice pack', 'Peaches, canned, light syrup pack', 'Pears, canned, light syrup pack', 'Pears, canned, heavy syrup', 'Pear nectar, canned, without added ascorbic acid', 'Peaches, canned, juice pack', 'Peaches, canned, heavy syrup', 'Apple juice, canned or bottled, unsweetened', 'Applesauce, canned, unsweetened', 'Peaches, canned, heavy syrup pack', 'Plums, canned, heavy syrup', 'Plums, canned, purple', 'Pears, canned, heavy syrup pack', 'Fruit cocktail, canned, heavy syrup', 'Peaches, yellow, raw', 'Blueberries, raw', 'Pears, raw']	['Celery, raw', 'Peaches, yellow, raw', 'Dates, medjool', 'Blueberries, raw', 'Milk, chocolate, fluid', 'Pears, raw', 'Rhubarb, raw', 'Bananas, raw']	['Pickles, cucumber, sweet ', 'Peach nectar, canned, with sucralose', 'Pomegranate juice, bottled', 'Papaya nectar, canned', 'Cranberries, dried, sweetened ', 'Blueberries, dried, sweetened', 'Pears, canned, juice pack', 'Peaches, canned, light syrup pack', 'Cherries, tart, dried', 'Pears, canned, light syrup pack', 'Pears, canned, heavy syrup', 'Ice cream sandwich, vanilla, light', 'Pear nectar, canned, without added ascorbic acid', 'Peaches, canned, juice pack', 'Peaches, canned, heavy syrup', 'Apple juice, canned or bottled, unsweetened', 'Applesauce, canned, unsweetened', 'Peaches, canned, heavy syrup pack', 'Plums, canned, heavy syrup', 'Milk dessert bar, frozen, made from lowfat milk', 'Plums, canned, purple', 'Pears, canned, heavy syrup pack', 'Fruit cocktail, canned']
usda#04529	Oil, almond	['Oil, sunflower, linoleic', 'Oil, cottonseed, salad or cooking', 'Oil, wheat germ', 'Oil, peanut, salad or cooking', 'Lard']	['Milk, dry, whole', 'SILK Coffee, soymilk', 'Potato flour', 'Wheat flour, whole-grain ', 'Vanilla extract', 'Milk, filled, fluid']	['Oil, sunflower, linoleic', 'Oil, cottonseed, salad or cooking', 'Fish, fish sticks, frozen', 'Nuts, almond paste', 'Oil, wheat germ', 'Oil, peanut, salad or cooking', 'Sauce, pasta, spaghetti/marinara', 'Lard', 'Ice cream, bar or stick, chocolate covered']
usda#07022	Frankfurter, beef, unheated	['Frankfurter, meat and poultry, unheated', 'Sausage, pork, chorizo', 'Pickle and pimiento loaf, pork', 'Pork sausage, link/patty, cooked', 'Mortadella, beef, pork', 'Sausage, smoked link sausage, pork']	['SILK Coffee, soymilk', 'Sauce, peppers, hot', 'Sausage, smoked link sausage, pork', 'Soup, beef broth, cubed']	['Oil, canola', 'Oil, peanut, salad or cooking', 'Oil, sesame, salad or cooking', 'Oil, corn, industrial and retail', 'Oil, olive, salad or cooking', 'Salad dressing, honey mustard, regular', 'Lard', 'Butter oil, anhydrous', 'Oil, coconut', 'Ice cream, bar or stick, chocolate covered', 'Shortening, vegetable, household', 'Oil, walnut', 'Frankfurter, meat and poultry, unheated', 'Salad dressing, sesame seed dressing, regular', 'Soup, chicken vegetable with potato and cheese, chunky', 'Ice cream, soft serve, chocolate', 'Salad dressing, poppyseed, creamy', 'Salad dressing, blue or roquefort cheese dressing, commercial', 'Sausage, pork, chorizo', 'Margarine-like, margarine-butter blend, soybean oil and butter', 'Salad dressing, french dressing, commercial', 'Pickle and pimiento loaf, pork', 'Pork sausage, link/patty, cooked', 'Mortadella, beef, pork']
usda#11300	Peas, edible-podded, raw	['Sauerkraut, canned, solids and liquids', 'Beans, shellie, canned', 'Lima beans, immature seeds, raw', 'Beans, kidney, red', 'Peas, edible-podded, raw', 'Mushrooms, shiitake, raw', 'Asparagus, raw', 'Egg, whole, raw', 'Poi', 'Peas, edible-podded, frozen', 'Beans, snap, green', 'Peas, green, frozen', 'Cheese, cottage, creamed']	['Potatoes, mashed, home-prepared', 'Grape leaves, raw', 'Beans, shellie, canned', 'Lima beans, immature seeds, raw', 'Peppers, sweet, yellow', 'Barley malt flour', 'Cabbage, raw', 'Milk, canned, condensed', 'Spices, nutmeg, ground', 'Barley, hulled', 'Beans, kidney, red', 'Spices, cinnamon, ground', 'Celery, raw', 'Apple juice, frozen concentrate, unsweetened', 'Broccoli, raw', 'Fat, chicken', 'Nance, canned, syrup', 'Capers, canned', 'Spices, pepper, red or cayenne', 'Corn grain, yellow', 'Salad dressing, russian dressing', 'Cream substitute, powdered', 'Peas, edible-podded, raw', 'Vanilla extract', 'Mushrooms, shiitake, raw', 'Asparagus, raw', 'Candied fruit', 'Applesauce, canned, unsweetened', 'Egg, whole, raw', 'Poi', 'Peas, edible-podded, frozen', 'Coriander leaves, raw', 'Basil, fresh', 'Beans, snap, green', 'Papaya nectar, canned', 'Sour cream, fat free', 'Oil, coconut', 'Wheat flour, whole-grain ', 'Spices, cardamom', 'Potatoes, hash brown, home-prepared', 'Kale, raw', 'Carrots, raw', 'Spices, pepper, black', 'Ham, honey, smoked', 'Spices, onion powder', 'Whey, sweet, fluid', 'Peas, green, frozen', 'Cheese, cottage, creamed', 'Corn pudding, home prepared']	['Sauerkraut, canned, solids and liquids', 'Mulberries, raw', 'Parsley, fresh']
usda#06931	Sauce, pasta, spaghetti/marinara	[]	['Quinoa, uncooked', 'Sauce, alfredo mix, dry', 'Pasta, dry, enriched', 'Chard, swiss, raw', 'Barley, hulled', 'Potatoes, hash brown, home-prepared']	['Oil, wheat germ', 'Nuts, almond paste', 'Fish, fish sticks, frozen', 'Oil, sunflower, linoleic', 'Oil, cottonseed, salad or cooking', 'Oil, almond']
usda#11955	Tomatoes, sun-dried	['Tomatoes, crushed, canned', 'Tomato products, canned, paste']	['Tomatoes, sun-dried', 'Tomatoes, crushed, canned', 'Tomato products, canned, paste', 'Apple juice, frozen concentrate, unsweetened', 'Spices, chili powder', 'Peppers, sweet, red', 'Pasta, dry, enriched', 'Capers, canned', 'Sauce, pasta, spaghetti/marinara', 'Beans, snap, green', 'Spices, pepper, red or cayenne', 'Catsup', 'Soup, tomato, canned', 'Sauce, salsa, ready-to-serve', 'Squash, summer, zucchini', 'Spearmint, dried', 'Sauce, tomato chili sauce, bottled']	[]
usda#04047	Oil, coconut	['Oil, sesame, salad or cooking', 'Oil, olive, salad or cooking', 'Shortening, vegetable, household', 'Oil, walnut', 'Butter oil, anhydrous', 'Oil, corn, industrial and retail', 'Lard', 'Oil, peanut, salad or cooking', 'Oil, canola', 'Margarine-like, margarine-butter blend, soybean oil and butter', 'Oil, vegetable, soybean', 'Margarine, regular, hard']	['Oil, canola', 'Butter, salted', 'Soy flour, defatted', 'Nuts, coconut cream, raw ', 'Cheese, blue', 'Shortening frying , palm ', 'Peanut Butter, smooth ', 'Pasta, gluten-free, corn flour and quinoa flour', 'Oil, vegetable, soybean', 'Oil, olive, salad or cooking', 'Milk, filled, fluid', 'Bananas, raw', 'Spices, cinnamon, ground', 'Prune puree', 'Apple juice, frozen concentrate, unsweetened', 'Milk, canned, evaporated', 'Soup, stock, beef', 'Pumpkin, raw', 'Peas, edible-podded, raw', 'Vanilla extract', 'Margarine, regular, hard', 'Applesauce, canned, unsweetened', 'Peppermint, fresh', 'Sauce, chili, peppers', 'Oil, coconut', 'Yogurt, Greek, vanilla', 'Yogurt, Greek, plain', 'Potatoes, hash brown, home-prepared', 'Nuts, pecans', 'Abiyuch, raw', 'Nuts, almonds', 'Apples, canned, sweetened', 'Animal fat, bacon grease', 'Oil, sesame, salad or cooking', 'Potato flour', 'Yogurt, Greek, 2%fat', 'Spices, chili powder']	['Oil, sesame, salad or cooking', 'Oil, olive, salad or cooking', 'Shortening, vegetable, household', 'Oil, walnut', 'Butter oil, anhydrous', 'Oil, corn, industrial and retail', 'Lard', 'Oil, peanut, salad or cooking', 'Ice cream, bar or stick, chocolate covered', 'Frankfurter, meat and poultry, unheated', 'Oil, canola', 'Salad dressing, honey mustard, regular', 'Margarine-like, margarine-butter blend, soybean oil and butter', 'Frankfurter, beef, unheated', 'Ice cream, soft serve, chocolate', 'Sausage, pork, chorizo', 'Salad dressing, poppyseed, creamy', 'Soup, chicken vegetable with potato and cheese, chunky', 'Salad dressing, mayonnaise, regular', 'Salad dressing, sesame seed dressing, regular', 'Salad dressing, french dressing, commercial', 'Soup, cream of mushroom, low sodium']
usda#09160	Lime juice, raw	['Oranges, raw, all commercial varieties', 'Grapefruit juice, white, canned or bottled', 'Orange juice, chilled, includes from concentrate', 'Tangerines, raw', 'Tangerine juice, raw', 'Tangerines, canned', 'Juice, apple and grape blend, with added ascorbic acid', 'Mango nectar, canned', 'Grapefruit juice, white, raw', 'Guanabana nectar, canned', 'Strawberries, frozen, unsweetened ', 'Grape juice, canned or bottled, unsweetened', 'Litchis, raw', 'Grapefruit, raw, pink and red and white', 'Lemon juice, raw', 'Orange Pineapple Juice Blend', 'Lemons, raw, without peel']	['Vinegar, red wine', 'Basil, fresh', 'Cream, whipped, cream topping', 'Orange juice, raw ', 'Lemon juice, raw', 'Cheese, cream']	['Oranges, raw, all commercial varieties', 'Grapefruit juice, white, canned or bottled', 'Orange juice, chilled, includes from concentrate', 'Grapefruit, sections, canned', 'Tangerines, raw', 'Tangerine juice, raw', 'Tangerines, canned', 'Juice, apple and grape blend, with added ascorbic acid', 'Mango nectar, canned', 'Grapefruit juice, white, raw', 'Guanabana nectar, canned', 'Strawberries, frozen, unsweetened ', 'Grape juice, canned or bottled, unsweetened', 'Litchis, raw', 'Brussels sprouts, raw', 'Grapefruit, raw, pink and red and white', 'Lemon juice, raw', 'Orange Pineapple Juice Blend', 'Lemons, raw, without peel', 'Broccoli, raw']
usda#01123	Egg, whole, raw	['Cheese, cottage, lowfat', 'Fish, haddock, smoked', 'Chicken patty, frozen, cooked', 'Egg, whole, cooked', 'Luncheon meat, pork with ham, minced', 'Tofu, silken', 'Egg substitute, powder']	['Applesauce, canned, unsweetened', 'Egg, whole, raw', 'Spices, onion powder', 'Butter, salted', 'Baobab powder', 'Soy meal, defatted, raw', 'MORI-NU, Tofu, silken', 'Spices, anise seed', 'Pepper, banana, raw', 'Egg substitute, powder', 'Milk, filled, fluid']	['Cheese, cottage, lowfat', 'Fish, haddock, smoked', 'Chicken patty, frozen, cooked', 'Egg, whole, cooked', 'Luncheon meat, pork with ham, minced']
usda#01004	Cheese, blue	['Cheese, Mexican blend', 'Cheese, brie', 'Cheese, gouda', 'Cheese, goat, hard type', 'Cheese, feta']	['Spices, pepper, black', 'Ham, sliced, pre-packaged', 'Cheese, blue', 'Cheese, goat, hard type', 'Cheese, feta', 'Onions, dehydrated flakes', 'Yogurt, Greek, plain']	['Bologna, meat and poultry', 'Cheese, Mexican blend', 'Cheese, brie', 'Bologna, beef', 'Salad dressing, blue or roquefort cheese dressing, commercial', 'Butter, light, stick', 'Cheese, gouda', 'Pork sausage, link/patty, cooked', 'Mortadella, beef, pork', 'Soup, cream of mushroom, low sodium', 'Frankfurter, chicken', 'Ice cream, soft serve, chocolate', 'Salad dressing, french dressing, commercial']
usda#09152	Lemon juice, raw	['Lemons, raw, without peel', 'Papayas, raw', 'Grapefruit, raw, pink and red and white',  'Tomato juice, canned, without salt added', 'Lemon juice from concentrate, canned or bottled', 'Melons, honeydew, raw', 'Currants, red and white, raw', 'Yambean, raw', 'Limes, raw']	['Vinegar, red wine', 'Lemon juice from concentrate, bottled, CONCORD', 'Nuts, coconut cream, raw ', 'Milk, filled, fluid', 'Cheese, dry white, queso seco', 'Limes, raw', 'Pineapple, frozen, chunks', 'Vanilla extract', 'Vinegar, cider', 'Vinegar, balsamic', 'Goji berries, dried', 'Orange juice, raw ', 'Yogurt, Greek, plain', 'Lime juice, raw', 'Abiyuch, raw', 'Spices, pepper, black', 'Oranges, raw, California', 'Pineapple, canned, juice pack', 'Lemon juice, raw', 'Soup, stock, chicken']	['Lemons, raw, without peel', 'Vegetable juice cocktail, canned', 'Papayas, raw', 'Grapefruit, raw, pink and red and white', 'Broccoli, raw', 'Kohlrabi, raw', 'Tomato juice, canned, with salt added', 'Tomato juice, canned, without salt added', 'Brussels sprouts, raw', 'Lemon juice from concentrate, canned or bottled', 'Cauliflower, green, raw', 'Cabbage, chinese, raw', 'Cabbage, red, raw', 'Melons, honeydew, raw', 'Tomatoes, green, raw', 'Cress, garden, raw', 'Currants, red and white, raw', 'Rutabagas, raw', 'Cabbage, raw', 'Mustard greens, raw', 'Yambean, raw', 'Tomatoes, red, ripe', 'Squash, summer, zucchini', 'Limes, raw', 'Squash, summer, all varieties', 'Turnips, raw']
usda#09085	Currants, zante, dried	['Figs, dried, stewed', 'Raisins, dark, seedless ', 'Plums, dried, uncooked', 'Pears, dried, sulfured', 'Peaches, dried, sulfured', 'Plums, dried, stewed', 'Cranberries, raw', 'Raisins, golden, seedless', 'Raisins, seeded', 'Dates, medjool']	['Cranberries, raw', 'Raisins, golden, seedless', 'Cranberries, dried, sweetened ', 'Raisins, seeded', 'Dates, medjool']	['Figs, dried, stewed', 'Raisins, dark, seedless ', 'Plums, dried, uncooked', 'Pears, dried, sulfured', 'Peaches, dried, sulfured', 'Bananas, dehydrated, or banana powder', 'Plums, dried, stewed']
usda#12147	Nuts, pine nuts, dried	['Nuts, hazelnuts or filberts', 'Nuts, brazilnuts, dried', 'Nuts, almonds', 'Nuts, walnuts, black', 'Seeds, pumpkin and squash seeds, whole', 'Nuts, walnuts, dry roasted', 'Seeds, flaxseed', 'Nuts, pecans', 'Seeds, sunflower seed kernels, dried']	['Nuts, almonds', 'Nuts, walnuts, black', 'Seeds, pumpkin and squash seeds, whole', 'Nuts, walnuts, dry roasted', 'Seeds, flaxseed', 'Nuts, pecans', 'Seeds, sunflower seed kernels, dried', 'Veal, variety meats and by-products, liver']	['Nuts, hazelnuts or filberts', 'Nuts, brazilnuts, dried']
usda#11333	Peppers, sweet, green	['Pepper, banana, raw', 'Peppers, serrano, raw', 'Peppers, jalapeno, canned']	['Soup, pea, green', 'Celery, raw', 'Okra, raw', 'Peas, edible-podded, frozen', 'Mushrooms, shiitake, raw', 'Cabbage, raw', 'Spices, pepper, red or cayenne', 'Pepperoni, beef and pork, sliced', 'Sauce, hot chile, sriracha', 'Peas, edible-podded, raw', 'Peppers, jalapeno, canned']	['Pepper, banana, raw', 'Melons, casaba, raw', 'Peppers, serrano, raw', 'Kohlrabi, raw', 'Lemons, raw, without peel', 'Plantains, yellow, raw', 'Lemon juice, raw', 'Vegetable juice cocktail, canned']
usda#12061	Nuts, almonds	['Nuts, almonds, dry roasted', 'Peanuts, all types, oil-roasted', 'Nuts, brazilnuts, dried', 'Nuts, hazelnuts or filberts', 'Seeds, sunflower seed kernels, dry roasted', 'Soybeans, mature seeds, roasted', 'Seeds, sesame seeds, whole', 'Nuts, walnuts, black', 'Nuts, pine nuts, dried', 'Nuts, cashew nuts, raw', 'Peanuts, spanish, raw', 'Nuts, pecans', 'Nuts, macadamia nuts, raw']	['Nuts, almonds', 'Seeds, sesame seeds, whole', 'Nuts, walnuts, black', 'Nuts, pine nuts, dried', 'Raisins, golden, seedless', 'Nuts, cashew nuts, raw', 'Spices, allspice, ground', 'Milk, chocolate, fluid', 'Oil, coconut', 'Spices, anise seed', 'Cranberries, dried, sweetened ', 'Oats ', 'Raisins, seeded', 'Peanuts, spanish, raw', 'Nuts, pecans', 'Seeds, sunflower seed kernels, dried', 'Nuts, macadamia nuts, raw']	['Nuts, almonds, dry roasted', 'Peanuts, all types, oil-roasted', 'Nuts, brazilnuts, dried', 'Nuts, hazelnuts or filberts', 'Seeds, sunflower seed kernels, dry roasted', 'Soybeans, mature seeds, roasted']
usda#06015	Soup, chicken, canned	['Gravy, chicken, canned or bottled']	['Oscar Mayer, Chicken Breast ', 'Soup, cream of mushroom, canned']	['Seeds, sesame butter, tahini', 'Gravy, chicken, canned or bottled']
usda#09032	Apricots, dried, sulfured	[]	['Spearmint, dried']	[]
usda#11124	Carrots, raw	['Carrots, canned, no salt added']	['Beans, black, mature seeds', 'Peppers, sweet, green', 'Peas, green, frozen', 'Beans, snap, green', 'Spices, pepper, red or cayenne', 'Spinach, raw', 'Onions, young green, tops only', 'Mushrooms, shiitake, raw', 'Peas, edible-podded, raw', 'Potatoes, hash brown, home-prepared', 'Water convolvulus,raw', 'Loganberries, frozen']	['Soup, beef and vegetables, canned', 'Melons, cantaloupe, raw', 'Dandelion greens, raw', 'Carrots, canned, no salt added', 'Apricots, canned, juice pack']
usda#11109	Cabbage, raw	['Cabbage, chinese, raw', 'Cress, garden, raw', 'Turnips, raw', 'Rutabagas, raw', 'Mustard greens, raw', 'Tomatoes, green, raw', 'Cauliflower, green, raw', 'Broccoli, raw', 'Cabbage, red, raw', 'Brussels sprouts, raw', 'Tomatoes, red, ripe', 'Kohlrabi, raw', 'Limes, raw', 'Sauerkraut, canned, solids and liquids', 'Spinach, raw', 'Carrots, raw']	['Broccoli, raw', 'Seasoning mix, dry, sazon', 'Sauerkraut, canned, solids and liquids', 'Spinach, raw', 'Carrots, raw', 'Mothbeans, mature seeds, raw']	['Melons, honeydew, raw', 'Cabbage, chinese, raw', 'Cress, garden, raw', 'Turnips, raw', 'Rutabagas, raw', 'Mustard greens, raw', 'Yambean, raw', 'Squash, summer, zucchini', 'Tomato juice, canned, with salt added', 'Tomatoes, green, raw', 'Currants, red and white, raw', 'Cauliflower, green, raw', 'Vegetable juice cocktail, canned', 'Broccoli, raw', 'Cabbage, red, raw', 'Lemon juice, raw', 'Grapefruit, raw, pink and red and white', 'Lemons, raw, without peel', 'Papayas, raw', 'Brussels sprouts, raw', 'Squash, summer, all varieties', 'Tomatoes, red, ripe', 'Tomato juice, canned, without salt added', 'Lemon juice from concentrate, canned or bottled', 'Kohlrabi, raw', 'Limes, raw']
usda#01053	Cream, fluid, heavy whipping	['Sour cream, light', 'Cream, fluid, light ', 'Cream, fluid, light whipping', 'Milk, canned, condensed', 'Cream, sour, cultured', 'Yogurt, plain, skim milk', 'Yogurt, Greek, 2%fat']	['Sour cream, light', 'Milk, dry, whole', 'Milk, buttermilk, fluid', 'Cream, fluid, light ', 'Cream, fluid, light whipping', 'Fat, chicken', 'Milk, canned, condensed', 'Cream, sour, cultured', 'Yogurt, plain, skim milk', 'HOUSE FOODS Premium Soft Tofu', 'Milk, filled, fluid', 'Yogurt, Greek, 2%fat']	[]
usda#09316	Strawberries, raw	['Strawberries, frozen, unsweetened ', 'Raspberries, raw', 'Grapes, american type , raw', 'Loganberries, frozen', 'Cranberries, raw', 'Blueberries, raw', 'Pineapple, frozen, chunks', 'Pears, raw', 'Blackberries, raw', 'Blackberries, frozen, unsweetened', 'Raspberries, frozen, red']	['Cranberries, raw', 'Blueberries, raw', 'Raspberries, raw', 'Nance, canned, syrup', 'Pineapple, frozen, chunks', 'Pears, raw', 'Blackberries, raw', 'Blackberries, frozen, unsweetened', 'Raspberries, frozen, red']	['Grape juice, canned or bottled, unsweetened', 'Strawberries, frozen, unsweetened ', 'Orange Pineapple Juice Blend', 'Raspberries, raw', 'Grapes, american type , raw', 'Loganberries, frozen', 'Strawberries, frozen, sweetened']
usda#09081	Cranberry sauce, canned, sweetened	[]	['Chicken spread', 'Catsup']	[]
usda#11011	Asparagus, raw	['Tomatoes, sun-dried', 'Celery, raw', 'Broccoli, raw', 'Beans, snap, green', 'Squash, summer, zucchini', 'Peas, edible-podded, raw', 'Carrots, raw']	['Tomatoes, sun-dried', 'Celery, raw', 'Broccoli, raw', 'Beans, snap, green', 'Squash, summer, zucchini', 'Peas, edible-podded, raw', 'Carrots, raw']	['Beets, canned, no salt added']
usda#20033	Oat bran, raw	['Wheat bran, crude']	['Nuts, almonds', 'Wheat bran, crude', 'Oil, wheat germ']	['Seeds, sesame seed kernels, toasted']
usda#12117	Nuts, coconut milk, raw	[]	['Milk, filled, fluid', 'Milk, buttermilk, fluid']	[]
usda#01095	Milk, canned, condensed	['Milk, canned, evaporated', 'Milk, filled, fluid']	['Peas, edible-podded, raw', 'Potatoes, hash brown, home-prepared', 'Milk, canned, evaporated', 'Milk, filled, fluid']	['Fruit cocktail, canned', 'Pears, raw', 'Cherries, sweet, raw', 'Milk dessert bar, frozen, made from lowfat milk', 'Peaches, canned, heavy syrup pack', 'Pears, canned, heavy syrup pack', 'Peaches, canned, juice pack', 'Plums, canned, heavy syrup', 'Apple juice, canned or bottled, unsweetened', 'Plums, canned, purple']
usda#04582	Oil, canola	['Oil, sesame, salad or cooking', 'Oil, corn, industrial and retail', 'Lard', 'Oil, peanut, salad or cooking', 'Oil, olive, salad or cooking', 'Oil, coconut', 'Oil, walnut', 'Shortening, vegetable, household', 'Butter oil, anhydrous', 'Margarine-like, margarine-butter blend, soybean oil and butter', 'Oil, safflower, salad or cooking', 'Oil, coconut', 'Oil, vegetable, soybean']	['Applesauce, canned, unsweetened', 'Oil, sesame, salad or cooking', 'Butter, salted', 'Olive loaf, pork', 'Oil, safflower, salad or cooking', 'Oil, coconut', 'Oil, vegetable, soybean', 'Oil, olive, salad or cooking']	['Oil, sesame, salad or cooking', 'Frankfurter, beef, unheated', 'Oil, corn, industrial and retail', 'Lard', 'Oil, peanut, salad or cooking', 'Oil, olive, salad or cooking', 'Ice cream, bar or stick, chocolate covered', 'Oil, coconut', 'Salad dressing, honey mustard, regular', 'Oil, walnut', 'Shortening, vegetable, household', 'Butter oil, anhydrous', 'Frankfurter, meat and poultry, unheated', 'Salad dressing, poppyseed, creamy', 'Salad dressing, sesame seed dressing, regular', 'Soup, chicken vegetable with potato and cheese, chunky', 'Margarine-like, margarine-butter blend, soybean oil and butter', 'Sausage, pork, chorizo', 'Ice cream, soft serve, chocolate', 'Pork sausage, link/patty, cooked', 'Salad dressing, blue or roquefort cheese dressing, commercial', 'Mortadella, beef, pork', 'Cheese, gouda', 'Salad dressing, mayonnaise, regular']
usda#01023	Cheese, gruyere	['Cheese, pasteurized process, American', 'Cheese, parmesan, hard', 'Cheese, ricotta, whole milk', 'Cheese, cheddar, nonfat or fat free', 'Cheese, provolone', 'Cheese, swiss']	['Cheese, cheddar ', 'Cheese, provolone', 'Cheese, gruyere', 'Cheese, swiss']	['Cheese, pasteurized process, American', 'Cheese, parmesan, hard', 'Milk, dry, whole', 'Milk, whole, 3.25% milkfat', 'Milk, low sodium, fluid', 'Salad dressing, mayonnaise, regular', 'Milk, buttermilk, fluid', 'Cheese, ricotta, whole milk', 'Cheese, cheddar, nonfat or fat free']
